{
  "$schema": "../schema/forge.schema.json",
  "_doc": "08 §4.1-4.3 (merge, enhance, salvage) and 24 §6.1-6.2 (reforge, retune). 25 §7 E9/E10: MergeCrownCost and the +11 to +15 stone costs must be re-derived by the simulator with dungeons, events and guilds enabled together; do not pre-emptively tune them by hand.",
  "_status": "partial",
  "merge": {
    "_doc": "08 §4.1",
    "inputCount": 3,
    "dustSubstituteMaxInputs": 1,
    "availableFromRarity": "C",
    "availableToRarity": "SS",
    "outputQualityRule": "MAX_OF_REAL_INPUTS",
    "outputChapterOriginRule": "MAX_OF_REAL_INPUTS",
    "outputKeepsSharedEnhanceLevel": true,
    "outputRerollsAffixes": true,
    "dustSubstituteCost": { "C": 50, "B": 200, "A": 800, "S": 3200, "SS": null },
    "crownCostByOutputRarity": { "B": 120, "A": 600, "S": 3000, "SS": 15000 }
  },
  "enhance": {
    "_doc": "08 §4.2. successRateBands gives endpoints ('85% -> 65%', '50% -> 25%'); the arrow is the document's ramp notation, so perLevelSuccessRate is those endpoints spread LINEARLY and evenly across each band's five levels — step -0.05 and step -0.0625. Every value is a function of two published endpoints and none was chosen for feel; the second band is non-integral by construction and is not rounded to look tidy.",
    "minLevel": 0,
    "maxLevel": 15,
    "statBonusPerLevel": 0.07,
    "totalMultiplierAtMax": 2.05,
    "neverDestroysOrDowngrades": true,
    "failureLosesLevel": false,
    "failureConsumesStones": true,
    "stoneCostPerLevel": [2, 3, 4, 6, 8, 12, 16, 22, 30, 40, 55, 75, 100, 140, 200],
    "successRateBands": [
      { "fromLevel": 1, "toLevel": 5, "startRate": 1.0, "endRate": 1.0 },
      { "fromLevel": 6, "toLevel": 10, "startRate": 0.85, "endRate": 0.65 },
      { "fromLevel": 11, "toLevel": 15, "startRate": 0.5, "endRate": 0.25 }
    ],
    "perLevelSuccessRate": [
      1.0, 1.0, 1.0, 1.0, 1.0,
      0.85, 0.8, 0.75, 0.7, 0.65,
      0.5, 0.4375, 0.375, 0.3125, 0.25
    ],
    "plusLuckyChargesPerDay": 3,
    "plusLuckyPercentagePoints": 15,
    "plusLuckyChargesAccumulate": false
  },
  "salvage": {
    "_doc": "08 §4.3. Merge Dust and the stone refund only: 24 §5.1's Set Token yield has no number here and no wallet row to move into, so it stays absent rather than guessed. The auto-salvage filter's rules are per-player configuration rather than tuning, so no default filter is authored.",
    "baseDustByRarity": { "C": 10, "B": 40, "A": 160, "S": 640, "SS": 2560 },
    "dustPerEnhanceLevel": 0.15,
    "stoneRefundShare": 0.6
  },
  "reforge": {
    "_doc": "24 §6.1 — quality re-roll, keep-best, unlimited attempts. Mirrored in luck.json; this is the forge-screen view of the same numbers.",
    "currency": "MERGE_DUST",
    "costByRarity": { "C": 100, "B": 300, "A": 1000, "S": 4000, "SS": 12000 }
  },
  "retune": {
    "_doc": "24 §6.2 — affix re-roll with lockable affixes and a wishlist. No C-rarity row: C items roll no affixes (08 §2).",
    "currency": "ENHANCE_STONES",
    "costByRarity": { "B": 20, "A": 60, "S": 200, "SS": 600 },
    "lockCostMultiplier": { "1": 2, "2": 5, "3": 12 },
    "wishlistMaxAffixes": 3,
    "wishlistMissWeightBonus": 0.1
  },
  "inventory": {
    "_doc": "08 §5 and 10 §4 — expansion prices are authored in currencies.json (the Crown ladder) and 10 §2 (the flat Soul Shard alternative). maxCapacity is the ceiling the ladder actually reaches: baseCapacity + inventoryExpansionMaxPurchases × inventoryExpansionSlotsPerPurchase = 120 + 10 × 20 = 320. It is not an independent number, and InventoryTuning refuses the document if the three stop agreeing.",
    "baseCapacity": 120,
    "expansionStep": 20,
    "maxCapacity": 320
  }
}
